<?xml version="1.0"?>
<ipo:PURCHASEORDER xmlns:xsi="http://www.w3.org/2001/XMLSchema-instance"
                   xmlns:ipo="http://www.example.org/IPO"
                   xsi:schemaLocation="http://www.example.org/IPO demo-3.xsd"
                   PRODID="P001" ORDERID="O001">
    <ORDER>
        <DATE>2000-02-13</DATE>
        <PRODUCTNAME>BARBIE DOLL</PRODUCTNAME>
        <SUPPLIERNAME>MIKE</SUPPLIERNAME>
        <ADDRESS>15, LITION STREET</ADDRESS>
        <QUANTITY>3</QUANTITY>
        <PRICEPERQTY>200</PRICEPERQTY>
    </ORDER>
</ipo:PURCHASEORDER>
